{
  "schema_version": "minutes-version/1",
  "version_id": "c1d2e3f4-a5b6-4c7d-8e9f-0a1b2c3d4e5f",
  "session_id": "7c9b2b1e-6b6d-4f7a-9d3e-1a2b3c4d5e6f",
  "version_number": 1,
  "kind": "claude_generated",
  "created_by": "system:minutes-worker",
  "created_at": "2026-09-12T11:20:00+09:00",
  "parent_version_id": null,
  "restored_from_version_id": null,
  "transcript_revision": 1,
  "format_snapshot": null,
  "instructions": null,
  "insufficient_information": [],
  "title_proposal": "週次定例: ロードマップ確認",
  "artifact_id": "art_01J7Q0CCCCCCCCCCCCCCCCCCC1",
  "is_candidate": false
}
